{
  "$schema": "https://json-schema.org/draft/2020-12/schema",
  "$id": "https://github.com/RNA4219/manual-bb-test-harness/schemas/manual_case_set.schema.json",
  "title": "ManualCaseSet",
  "description": "Executable manual test cases and exploratory charters artifact. Produced by synthesize_manual_cases workflow step.",
  "type": "object",
  "required": [
    "feature_id",
    "manual_cases",
    "spec_revision"
  ],
  "properties": {
    "feature_id": {
      "type": "string",
      "minLength": 1,
      "description": "Reference to the feature_spec feature_id these cases cover."
    },
    "spec_revision": {
      "type": "string",
      "minLength": 1,
      "description": "Feature specification revision used to design this case set and bind exported execution evidence."
    },
    "manual_cases": {
      "type": "array",
      "items": {
        "$ref": "#/$defs/ManualTestCase"
      },
      "description": "Scripted manual test cases with steps, expected results, and oracle references."
    },
    "exploratory_charters": {
      "type": "array",
      "items": {
        "$ref": "#/$defs/ExploratoryCharter"
      },
      "description": "Exploratory testing charters for areas with weak oracles or high uncertainty."
    },
    "platform_matrix": {
      "type": "array",
      "items": {
        "$ref": "#/$defs/PlatformMatrixEntry"
      },
      "description": "Platform coverage matrix for mobile testing: OS x lifecycle x network combinations."
    },
    "role_matrix": {
      "type": "array",
      "items": {
        "$ref": "#/$defs/RoleMatrixEntry"
      },
      "description": "Role-based access matrix: actor_role x target_role x action combinations."
    },
    "execution_configurations": {
      "type": "array",
      "minItems": 1,
      "items": {
        "type": "object",
        "required": [
          "id",
          "env"
        ],
        "properties": {
          "id": {
            "type": "string",
            "minLength": 1
          },
          "env": {
            "type": "string",
            "minLength": 1
          },
          "device": {
            "type": "string",
            "minLength": 1
          },
          "network_profile": {
            "type": "string",
            "minLength": 1
          }
        },
        "additionalProperties": false
      }
    }
  },
  "additionalProperties": false,
  "$defs": {
    "ManualTestCase": {
      "type": "object",
      "required": [
        "tc_id",
        "title",
        "priority",
        "primary_view",
        "steps",
        "expected_results",
        "oracle",
        "trace_to",
        "revision",
        "content_hash",
        "oracle_revision"
      ],
      "description": "Single scripted manual test case with complete execution instructions.",
      "properties": {
        "tc_id": {
          "type": "string",
          "minLength": 1,
          "description": "Unique test case identifier, e.g., 'TC-001'. Should be sequential within feature."
        },
        "revision": {
          "type": "string",
          "minLength": 1,
          "description": "Version of the test case used to bind execution evidence."
        },
        "content_hash": {
          "type": "string",
          "minLength": 1,
          "description": "Stable digest of executable case content."
        },
        "oracle_revision": {
          "type": "string",
          "minLength": 1
        },
        "title": {
          "type": "string",
          "minLength": 1,
          "description": "Short descriptive title for the test case."
        },
        "priority": {
          "enum": [
            "P0",
            "P1",
            "P2",
            "P3"
          ],
          "description": "Risk-based priority: P0 (critical), P1 (high), P2 (medium), P3 (low)."
        },
        "primary_view": {
          "enum": [
            "black",
            "gray",
            "white"
          ],
          "description": "Testing view: black (external UI), gray (limited diagnostic signals), white (implementation-level)."
        },
        "techniques": {
          "type": "array",
          "items": {
            "type": "string"
          },
          "description": "Test techniques used, e.g., 'state_transition', 'boundary_value', 'decision_table'."
        },
        "preconditions": {
          "type": "array",
          "items": {
            "type": "string"
          },
          "description": "Setup conditions required before execution, e.g., '注文状態=pending'."
        },
        "steps": {
          "type": "array",
          "items": {
            "type": "string"
          },
          "minItems": 1,
          "description": "Sequential execution steps. Each should be actionable and specific."
        },
        "expected_results": {
          "type": "array",
          "items": {
            "type": "string"
          },
          "minItems": 1,
          "description": "Observable expected outcomes after each step or at end."
        },
        "oracle": {
          "type": "object",
          "required": [
            "type",
            "refs"
          ],
          "description": "Oracle definition: how expected results are determined.",
          "properties": {
            "type": {
              "enum": [
                "specified",
                "derived",
                "implicit",
                "human"
              ],
              "description": "Oracle type: specified (in spec), derived (from rules), implicit (standard), human (judgment)."
            },
            "refs": {
              "type": "array",
              "items": {
                "type": "string"
              },
              "minItems": 1,
              "description": "References to source for oracle, e.g., ['AC-1', 'BR-2']."
            }
          },
          "additionalProperties": false
        },
        "source_ref": {
          "type": "object",
          "required": [
            "type",
            "refs"
          ],
          "description": "Source reference: where the test case requirement comes from.",
          "properties": {
            "type": {
              "enum": [
                "spec",
                "requirement",
                "acceptance",
                "risk",
                "user_request"
              ],
              "description": "Source type: spec, requirement, acceptance criteria, risk, or user request."
            },
            "refs": {
              "type": "array",
              "items": {
                "type": "string"
              },
              "minItems": 1,
              "description": "References to source documents, e.g., ['SPEC-ORD-CANCEL-01', 'AC-1']."
            }
          },
          "additionalProperties": false
        },
        "estimate_minutes": {
          "type": "number",
          "minimum": 0,
          "description": "Estimated execution time in minutes. Used for effort planning."
        },
        "trace_to": {
          "type": "array",
          "items": {
            "type": "string"
          },
          "minItems": 1,
          "description": "Traceability to observations and risks, e.g., ['OBS-STATE-01', 'RISK-01']."
        },
        "status": {
          "enum": [
            "active",
            "retired"
          ],
          "default": "active",
          "description": "Lifecycle status. active cases require manual execution; retired cases have moved to replacement automated evidence."
        },
        "retired_reason": {
          "type": "string",
          "minLength": 1,
          "description": "Reason this manual case was retired, e.g., moved to automated coverage."
        },
        "replacement_refs": {
          "type": "array",
          "items": {
            "type": "string",
            "minLength": 1
          },
          "minItems": 1,
          "description": "References to replacement coverage, e.g., ['hate:AETE-123']."
        },
        "placement_change_ref": {
          "type": "string",
          "minLength": 1,
          "description": "Reference ID for the QEG placement change record."
        },
        "configuration_ids": {
          "type": "array",
          "minItems": 1,
          "uniqueItems": true,
          "items": {
            "type": "string",
            "minLength": 1
          }
        }
      },
      "allOf": [
        {
          "if": {
            "properties": {
              "status": {
                "const": "retired"
              }
            },
            "required": [
              "status"
            ]
          },
          "then": {
            "required": [
              "retired_reason",
              "replacement_refs"
            ]
          }
        }
      ],
      "additionalProperties": false
    },
    "ExploratoryCharter": {
      "type": "object",
      "required": [
        "id",
        "title",
        "scope",
        "questions",
        "trace_to",
        "revision",
        "content_hash",
        "oracle_revision"
      ],
      "description": "Exploratory testing charter for areas requiring investigation rather than scripted steps.",
      "properties": {
        "id": {
          "type": "string",
          "minLength": 1,
          "description": "Unique charter identifier, e.g., 'CHARTER-001'."
        },
        "revision": {
          "type": "string",
          "minLength": 1
        },
        "content_hash": {
          "type": "string",
          "minLength": 1
        },
        "oracle_revision": {
          "type": "string",
          "minLength": 1
        },
        "title": {
          "type": "string",
          "minLength": 1,
          "description": "Short descriptive title for the charter's focus area."
        },
        "priority": {
          "enum": [
            "P0",
            "P1",
            "P2",
            "P3"
          ],
          "description": "Risk-based priority for charter allocation."
        },
        "scope": {
          "type": "string",
          "minLength": 1,
          "description": "Scope or domain to explore, e.g., 'network loss and retry during cancellation'."
        },
        "questions": {
          "type": "array",
          "items": {
            "type": "string"
          },
          "minItems": 1,
          "description": "Specific questions to answer during exploration."
        },
        "estimate_minutes": {
          "type": "number",
          "minimum": 0,
          "description": "Timebox for charter exploration in minutes."
        },
        "timebox_minutes": {
          "type": "number",
          "exclusiveMinimum": 0,
          "description": "Actual exploratory session timebox."
        },
        "session_notes": {
          "type": "array",
          "items": {
            "type": "string",
            "minLength": 1
          }
        },
        "findings": {
          "type": "array",
          "items": {
            "type": "string",
            "minLength": 1
          }
        },
        "retrospective": {
          "type": "string",
          "minLength": 1
        },
        "trace_to": {
          "type": "array",
          "items": {
            "type": "string"
          },
          "minItems": 1,
          "description": "Traceability to observations, e.g., ['OBS-RECOVERY-01']."
        },
        "configuration_ids": {
          "type": "array",
          "minItems": 1,
          "uniqueItems": true,
          "items": {
            "type": "string",
            "minLength": 1
          }
        }
      },
      "allOf": [
        {
          "if": {
            "anyOf": [
              {
                "required": [
                  "session_notes"
                ]
              },
              {
                "required": [
                  "findings"
                ]
              },
              {
                "required": [
                  "retrospective"
                ]
              }
            ]
          },
          "then": {
            "required": [
              "timebox_minutes",
              "session_notes",
              "findings",
              "retrospective"
            ]
          }
        }
      ],
      "additionalProperties": false
    },
    "PlatformMatrixEntry": {
      "type": "object",
      "required": [
        "platform",
        "lifecycle",
        "network"
      ],
      "description": "Platform coverage entry for mobile testing: OS, lifecycle state, and network condition.",
      "properties": {
        "platform": {
          "type": "string",
          "enum": [
            "iOS",
            "Android"
          ],
          "description": "Mobile platform: iOS or Android."
        },
        "lifecycle": {
          "type": "string",
          "enum": [
            "foreground",
            "background",
            "background_resume",
            "terminated"
          ],
          "description": "App lifecycle state: foreground, background, background_resume, or terminated."
        },
        "network": {
          "type": "string",
          "enum": [
            "online",
            "offline",
            "slow"
          ],
          "description": "Network condition: online, offline, or slow."
        },
        "permission": {
          "type": "string",
          "enum": [
            "granted",
            "denied",
            "not_requested"
          ],
          "description": "Optional permission state for permission-related tests."
        }
      },
      "additionalProperties": false
    },
    "RoleMatrixEntry": {
      "type": "object",
      "required": [
        "actor_role",
        "target_role",
        "action"
      ],
      "description": "Role-based access matrix entry: what action an actor can perform on a target.",
      "properties": {
        "actor_role": {
          "type": "string",
          "enum": [
            "owner",
            "admin",
            "editor",
            "viewer",
            "member",
            "invited"
          ],
          "description": "Role of the user performing the action."
        },
        "target_role": {
          "type": "string",
          "enum": [
            "owner",
            "admin",
            "editor",
            "viewer",
            "member",
            "invited"
          ],
          "description": "Role of the target user being acted upon."
        },
        "action": {
          "type": "string",
          "enum": [
            "can_change",
            "cannot_change",
            "cannot_change_last",
            "invite_only"
          ],
          "description": "Permitted action: can_change, cannot_change, cannot_change_last (boundary), or invite_only."
        },
        "ownership_context": {
          "type": "string",
          "enum": [
            "own_workspace",
            "other_workspace"
          ],
          "description": "Optional ownership context for multi-workspace scenarios."
        }
      },
      "additionalProperties": false
    }
  }
}
