{
  "feature_id": "EVIDENCE-LIFECYCLE",
  "manual_cases": [
    {
      "tc_id": "TC-1",
      "title": "保存",
      "priority": "P0",
      "primary_view": "black",
      "steps": [
        "保存する"
      ],
      "expected_results": [
        "保存される"
      ],
      "oracle": {
        "type": "specified",
        "refs": [
          "AC-1"
        ]
      },
      "trace_to": [
        "RISK-1",
        "OBS-SAVE-1"
      ],
      "revision": "case-rev-1",
      "content_hash": "sha256:evidence-lifecycle-tc-1",
      "oracle_revision": "oracle-rev-1"
    }
  ],
  "execution_configurations": [
    {
      "id": "android",
      "env": "Android"
    },
    {
      "id": "ios",
      "env": "iOS"
    }
  ],
  "spec_revision": "spec-rev-1"
}
